username,comment,likes,word_count
hxstr,"My wife and I used it to write a dispute letter for a parking ticket, and it was dismissed. One for one chat GPT",375,24
East_Ad6086,"We had an employee suffer a seizure at lunch in the the lunchroom and hit his head. While people were attending him I asked ChatGPT what we should do. It came back with 8-10 things, one of the things it stated was clearing a path for paramedics. So myself and others moved all the lunch tables to the outskirts of the room. When EMT came they were able to easily maneuver and get the person to the hospital. Again, since others were attending the individual I had time to do this. I thought it was very helpful.",839,97
justlurking9891,Writing custom bedtime stories for my daughter. Last night was Princess Hername and the dragon. I used to try make up bedtime stories but this is easier.,488,27
kittehs4eva,"I used it to help me get a new job. Specifically by figuring out questions I'll probably be asked, and gathering a list of questions to ask them. I'm also using it in the garden. For example ""what else can I plant in my apple tree guild?"". Same idea while fishing, ""what line rigging works best for Brown trout in April?"" Basically it's just fancy google for me at this point.",141,71
whoops53,"I used it last night to set up a spreadsheet full of healthy eating & exercise goals for the month of May. Its all step by step (daily and weekly), with recipes (breakfast, lunch & dinner) based on ingredients I have and my dietary needs. Hydration, study, and hobby time goals was next, and that's all sorted too. It was just a little experiment to see how it would all work, and I swear...its flawless! It would have taken me a few days to sort out a schedule, yet it took only an hour with ChatGPT.",333,96
paulfrehley5,I ask it to speak to me like it is Captain Jean Luc Picard and give me pep talks.,114,19
ohgoodthnks,"Im a research scientists but I’m also a metastatic cancer patient that really struggles with word recall when tired. 
 It’s removed so much stress for me, I can type /talk out 
a stream of consciousness. Paste it into GPT and it turns it into a scholarly paper 

It’s removed so much anxiety for me - it really is life changing tech",289,61
DeerPainting,I use it to write tons of stories. It's like an expansion pack for your imagination.,245,16
Illustrious-Score-94,"As an account manager I mostly use it to write emails to clients. I feed it detailed information, sometimes from multiple sources and ask it to summarise it and script it into an email.",62,34
Ghazzz,"I am a software developer. 

I have it respond to stuff I want to bring up with my team, to be better prepared for meetings. (""respond three times, once as project lead, once as an educated user, once as a malicious user""). I also like to give it proposed ideas and find pros/cons. It is also very useful in the initial phases of development, to more easily find where to focus attention. To be clear, I am not presenting as if these were my ideas, I am just the ""AI-whisperer"" in the group. There is an internal policy of not giving it actual code or detailed product descriptions.

It has also replaced most information-gathering web searches in my personal life, and this is where I have been playing around more.

Unsure what to make for dinner? Just ask for recepies including ""these things"", or ""what is left after I made the dinners this week"" when it starts having that granular information. Ask for new staple ingredients that I might like based on earlier feedback, generally it works great as a kitchen buddy. I even ask it if I have enough of some ingredient while at the store. ""Have to save money this week"" vs. ""This is an important dinner date"". ChatGPT knows what shelves different foods are stored on, and the best before dates on the dry goods. This is my ""complete information"" test, and it is working very well. It has made me eat better.

Other non-professional areas I have discussed are; leather shoe maintenance, fashion tips, beard grooming, house maintenance, renovation queries and organisation. These kinds of queries were iffy back in December, I expect the dataset had a lot of sponsored content, but it has gotten better since.

As for education, I have been trying to wrap my head around the magnetism/electrics end of physics, getting feedback on written texts and done lots of ethics discussion, to freshen up my Ex.Phil. and ethical computing courses. In an education/professional capacity I have also had it do two-paragraph summaries of algorithms and concepts that I have forgotten or never encountered before, this has saved me at least a week of work-related research this year.

The truly trivial stuff is novel jokes of the absurdist variety and job applications for non-existent fields.",53,382
TheCanadianDude27,"I use ChatGPT-4 for exploring ideas and assisting with my personal projects. And I use ChatGPT-3.5 for general inquiries and random thoughts, similar to how I use Google.",45,28
Danbrenn,I’m an IT administrator that’s had more luck sending error codes to ChatGPT and getting a solution than I do asking my entire US IT team for help.,45,28
Comfortable_Key9790,"I just used mine to interrogate the blood test results I just got from the doctors.

About a million times better than interpreting with Google.",87,25
trainmac,"Primarily I’m using it to write or improve code in a new app I’m working on. 

Also 
- had it give me a possible itinerary for a holiday my wife and I are planning
- got it to translate and interpret a quarterly report from a Japanese company that I’m interested investing in but only reports in Japanese
- my mum just had a pretty significant surgery and I used it to help her and us understand some of the medical things the doctors didn’t explain very well 
- have had it re-write a bunch of content for my website to make it more customer focussed",142,106
FudgingEgo,"It's excellent for helping me, a guy who cannot for the life of me do complex formulas on Excel..  


The best thing is I can explain my exact problem and the exact outcome I need and it will create the formula for me.",33,43
Venusaur6504,Corporate emails every day. They take so much time away from more important things like Breath of the Wild.,39,19
peach-from-poison,I'm in a fight with my sister and I have found it useful for giving me insight to how to better respond to her when she attacks me. It's giving me clearly concise healthy answers to her accusations and it's been great.,29,42
m0x,"My 10 year old son has speech and hearing issues which impact his reading ability. We work on lists of words, affixes and such - for things he’s struggling with he comes up with a narrative concept then I use chatGPT to write a story at his reading level including those exact words or language concepts he’s working on. He’s always excited cause it’s a story he wants to read - It’s a game changer for special needs education.",30,79
OracleGreyBeard,"I use it mostly for programming. It's great for writing small to medium classes or functions, it struggles as the requirement gets larger. It's amazing at writing test cases, like ""suggest 12 tests for this class and write them"". A couple weeks ago I realized I could make it write user stories and I almost fainted with glee.

My team also uses it for general troubleshooting and debugging.

Beyond that it's mostly miscellaneous use. I have a hard rule that I don't use it for any answer I can't personally verify so that limits my use cases to fiction, game design, recipes, etc. Things that don't need to be true to be valuable.",57,113
HomeStar182,I just recently discovered that Google sheets had a plug-in for ChatGPT and I’ve found it amazing! Started pulling in extra data that was difficult to get manually. So great!,57,30
downcolorfulhill,As a physical therapy it’s able to create home exercise programs for patients when you describe the condition. Amazing.,25,19
kidikur,"I have ADHD and utilize GPT-4 as a life coach and daily planner. Its ability to prioritize, reason, troubleshoot, and motivate makes it superior to average time management tools. When I fall behind, GPT-4 encourages me to persevere and updates my schedule accordingly. Additionally, it helps me strike a healthy balance between work and self-care, preventing me from overworking and burning out.

I also sometimes use it to take my very train of thought style of writing walls of text and format it to be more concise and coherent (like I did the section above)",27,95
wandastan4life,I'm currently using chatgpt to teach my Python by asking me to teach me certain concepts and give me exercises to solve. If I can't solve an exercise on my own I ask chat to solve it for me and to provide an explanation.,20,44
doubledewey,I have really poor organization. So I use it to help me with outlines to get started on assignments or to come up with structure for my day.,24,28
frodosbitch,"* custom cover letters for a job search

* travel itineraries 

* assisting with breaking down project requests into smaller tasks in a specific format",21,25
angelleye,"I am the Scrum Master on a scrum team that uses Jira.

I use GPT to write all of my user stories complete with test cases and acceptance criteria.

It does it beautifully and saves many hours of time.",22,39
AdLower8254,Responding to aggressive emails.,21,4
kevstauss,"- Writing ad and website copy.
- Writing website code when I don’t know how to fix something.
- Generating D&D ideas.
- Generating recipes given what ingredients we have available.
- Writing bedtime stories.",22,35
basilwhitedotcom,I have it play Shark Tank for my ideas,18,9
Snoo-93310,"1. I use it to check my own biases with op eds and speeches and other political stuff. If something makes me feel strongly, I copy it into chat gpt and ask it to tell me the logical fallacies and possible misinformation in the piece. It is a HUGE gut check!!

2. As a working parent, I use it to outsource domestic labour, specifically:

- voice to text explained our usual routine and asked it to turn them into concise instructions for the dogsitter rather than typing it all out myself

- type in the ingredients on sale at the local grocery store this week and generate a meal plan (or at least some good ideas!)

- generate custom fun bedtime stories for my kids (with themes/morals that align with things they are currently dealing with)

- get a starting point for lists of things to pack and prep for trips",17,151
PrestigiousMood6511,"When I started my position in 2019, I created a 'helper' spreadsheet for myself that I called my Assistant.  

Over the next couple of years, with the help of Google, I was able to hack together some queries and VBA that made my job much easier.  I named it Assistant2 and shared it with my boss and team. It was buggy and still pretty tailored to me so literally nobody used it.  

I spent the next year fine tuning it, working out most the bugs, adding a lot more code, and made it more versatile for other positions in our company.  After a period of hesitation, I sent Assistan3 to my boss and coworkers again.  This time, it was picked up by a couple people on the team and eventually passed around to a handful of others.  Success in my book! 

Then ChatGPT came out.

In less than 3 months, I ran every line of code I wrote through ChatGPT with 1 simple instruction:  ""Look at the code below, is there a more efficient way to get the same result?""  If I didn't understand the output, I would ask it to explain the code to me one line at a time.  If the code gave me errors, I would ask ChatGPT to fix it.  

Let me tell you, in the past 5 months I've learned more about SQL & VBA than I have in the past 5 years prior. Not only has it produced a polished product, but Assistant4 has been picked up by the majority of our C-suite which has been passed down to their employees!",17,267
charaznable1249,"Helping my homies job hunt with it ,editing cover letters and resumes.",16,12
Fr0thBeard,"I'm an educator. I use it to generate rubrics, emails, academic goals, comprehension questions.

As a dungeon master, I use it to flush out location descriptions , NPC back stories, etc. I write the big points and use ChatGPT for minor or out of the way topics that MAY come up, but I wouldn't feel disappointed if we didn't use in a session.",17,63
MyRealIngIngAcc,"Probably the most blank user here. I use GPT-4 for ""Googling"" things without Google, or studying. The more in-depth reason for its answers helps.",14,24
SteadfastEnd,"For me, I use it mainly for therapy, self-reflection, questions about medical or tax issues, and also just plain silly entertaining fantasies (""ChatGPT, write a story about the Dallas Cowboys drafting Randy Moss in 1998 and him scoring 50 touchdowns"")",27,40
SolitaryForager,"I use it to make drafts of some emails and memos. I’m actually very good at composition but overthinking everything and ADHD means it can be time consuming and stressful. ChatGPT will give me a perfectly bland and appropriate template that I can edit for tone and detail. I’ll also use it for problem solving, as if it is a reasonably knowledgeable colleague to bounce ideas off of, and developing outlines for projects (least helpful so far, because so much is specific to the people and environment I work with, but it can help with forming a basic structure). 

In my personal life, I’ve used it as a pocket therapist (with the right prompts), general problem solving - everything from prepping my chicken coop to prepping for a vet visit.",12,130
areacode212,"There are some YouTubers whose videos I like to take notes on.

So to make it easier for myself, one thing I've been doing regularly is taking the auto-generated transcripts of their videos and using ChatGPT to fix the punctuation, etc.

I created a couple of JavaScript pages (also with the help of ChatGPT, though I had to manually fix & tweak them) to help speed up my workflow (such as auto prepend my prompt to the copied text).

I also used it for some creative endeavors and I have to say that the results were surprisingly good. It helps if you say ""write me a (something) in the style of (whoever), and it has to include some lines about (this and that)"". For this one, I believe I used Bing's GPT-4.",13,132
Quirky-Yellow6862,I used it to write funding proposals for our community garden. 20 mins of effort awarded us $23k in grants last week.,13,22
rwhittak3,"I've used it to help me decide to what to make for dinner, after telling it certain ingredients that I'd like to use.  

I've also been working on building a prompt so that it can help me be a bartender - I basically tell it all of the stuff I have in my bar, give it a set of rules, and use it for drink suggestions.  It works surprisingly well",11,70
mrmczebra,Free therapy,11,2
toastedmeat_,Ask it stupid questions to make myself laugh,12,8
Zealousideal_Call238,i usually just have fun with it but also use it for studying. yesterday also tried to make some random code with it (i got no knowledge about code),11,29
rosesmellikepoopoo,"I’ve been using it to help me write cover letters for jobs I’m applying for. I input my cv and the job description and give it a brief as to what I want the cover letter to include.

It works really well, and it only takes 30 seconds to write the cover letters as opposed to 30 minutes + if I were to write them myself.",10,66
ByonKun,I'm using it to learn Korean.,11,6
deuel10080,"Helping me navigate Microsoft Power BI. I use it for help with Power Query, M Code, and DAX functions. It's super helpful.",10,22
Whazzahoo,I have used it to craft beautiful emails to my local school board and representatives.  I put in a few prompts and it gives me great letters that I copy and paste and send them off.,8,36
EyeletGuy,I play text based adventure games on Saturdays when I'm working. Things awesome lol,8,14
unimportantsarcasm,"I use ChatGPT to have many concepts that are in my books explained. I ask questions like: X thing is said in my book. What does it mean? or I do not get how that happens.  
I am Med Student, so there are many mechanisms that the book takes for granted that I know/ I remember so ChatGPT helps me with that.",8,62
oldcreaker,"If I am looking for an actual answer to a question, rather than search on Google and wade through a list of sponsored links to get to a link that might have an answer that's buried in a sea of text that forces me to go through a bunch more ads, I use chatGPT.

I am going to be sad when they monetize chatGPT and it just becomes yet another way to force me through a sea of ads.",9,79
_jpacek,ChatGPT solves the blank page problem for me. If I have a crazy idea I can ask chat GPT to throw something together and then I can take it and refine it and improve it and make it my own.,7,40
rjm101,I mostly use it to confirm things that I believe to be true.,7,13
FascinatingGarden,"There was a particular cookie my grandmother used to give me and I really liked the taste and texture, and I had looked at the grocery to no avail until one evening (at the store) I decided that it might be fruitful to ask ChatGPT for help.  By patiently interrogating ChatGPT and iteratively closing in on it through various descriptions, I discovered that it was SnackWell's.

I recently asked it a softball question about a certain UPDATE command in SQL.  Not super hard but I decided to use ChatGPT rather than sifting through search results (which also would have worked).  It did very well.

I've asked it legal questions about taxes and property rights and it seems pretty good at that.  Legal language, in an attempt to be reliable, has had to contort into some forms which can feel unnatural to those of us unaccustomed to it, but it can be fairly logical and consistent, and ChatGPT can parse that well and then translate it into forms which we can understand more easily.  It can also tirelessly rephrase and digest things for you, even providing examples for a concept.  I find this really useful.

In every interaction, watch out for occasional false positives.  If you're asking anything important, try to fact-check ChatGPT's answers.  Sometimes if you give it the Third Degree it will apologize and correct itself and provide additional useful information.",8,232
peepeepoopoo42069x,Its great for studying because most google searches nowadays you have to search through mountains of shit ads and pages full of nothing so chatgpt makes the process of getting exactly what you need so much easier,8,37
sunburn95,"Yesterday I wanted to try a new jamaican curry dish, however the recipe called for ""jamaican curry powder"". I live in a very white part of the world and was never going to find that in a shop

Standing in the spice aislI asked chatGPT how I make my own and it told me all the spices I need to make Jamiacan curry powder. So had a delicious dinner last night trying something a different because ChatGPT could swoop and save the day without wading through a dozen awful cooking websites 

Not exactly ground breaking, just a small example of how chatGPT has entered my life",7,106
TheOnlyJoe_,"College work

For legal reasons this is a joke",24,9
MisterHyman,"It writes code, i can now make anything ive ever wanted, there are no more excuses or road blocks anymore and the sky is the limit. I built a fully functioning app in 2 weeks",30,35
tytang1130,polish my email at work as I am not a native English speaker.,12,13
AnonymousGuy9494,"I use it mostly to study, test theories and for general curiosity.",6,12
Origamiflipper,I teach so i use it to help me create lesson plans.  It saves me hours of work,5,18
BrilliantBytes,"Literally everything.

Diet plans

Building products

Travel plans

Study questions

Someone said it well ""if you're not using chatgpt all day, you're not using it to its full potential""

...",6,30
opinionatedlyme,I am in college. My classes are difficult and some words I have to memorize for neuroanatomy are tricky. I use ChatGPT to make me poems and funny cartoon stories about the terminology I have to remember so learning is more fun. It works amazing.,7,45
Chris_1961,I used it for some insight into a couple of chapters of the book of Acts. I followed up with requests for deeper exposition and historical details on some parts of the answers and kept drilling in using that approach. Was impressed with the detail of the answers. I'm not a theologian so had to double check some stuff to make sure it was giving bs answers but seemed legit.,6,70
Potential_Fee4153,Asking what to say to angry gf.,7,7
edward_blake_lives,"I’m a ghostwriter and I have to interview executives regularly. I have an AI that transcribes the interviews automatically during calls then I feed that transcript into GPT4 and ask it to summarise the responses. Then I edit those summaries to write the articles. 

Without AI, this process would take me a week. Now I can write one every day. It’s already 5xing my earnings this year.",7,67
DastardlyDirtyDog,I like making it choose play lists for situations where music is wildly inappropriate.,5,14
J_T_09,I wrote a Shortcut for my phone where I can highlight a block of text and it summarizes it into 3-4 sentences.  It’s been great!,5,25
bxyankee90,D&D worldbuilding for stuff that i dont want to research myself lol,5,12
RagnarLothbrokJH,"- I am a Discord bot developer and ChatGPT has been incredible in helping me improve my coding skills, frequently I will send it my code, and ask for an improved version and to explain what was changed

On the non-coding side, I have been using it for general things (it’s hard to train my brain to think of asking ChatGPT)
An example is, I have ADHD, and I sometimes get super distracted if I remember a scene in a TV show but can’t remember what show. You can feed it details of the scene and it can tell you exactly what episode of a series it’s from. (Also works for movies)

Also I used it today for my car, I needed to know some details specific to my radio in my car, fed it the model number of the radio, and it helped me figure out some technical things I needed to know.",5,154
jtaylor307,"I have some coding background, but it's not in my normal job responsibilities. I use GPT-4 to write Google Apps Script to automate some of my daily work. My coding experience is enough that I can tell what the code is going to do, but it would take me a good bit of research to write that same code from scratch. It's a great time saver. I also use it like Google for application questions, how to do task x, etc. It's definitely improved my workflow and saved me a good bit of time.",5,94
bizzarrogeorge,To come up with new Adam Sandler movies,5,8
MiserablePicture3377,I use it to respond to my ex wife who is hostile to begin with. Makes things much easier.,6,19
BabyGro0t,"I’ve been using Chat GPT to teach me how to use Unity by making my dream game! It’s already functioning surprisingly. I always say it doesn’t just build the game, but it is exceptionally good at teaching me how to do it myself. I would never have picked up this hobby otherwise but it will be complete and on steam in 6 months! It’s also a very simple game without much reliance on rendering, visual assets, animations etc. since it’s a business simulator game. I’m actually having fun playing my own game 🤓",5,93
nestedbrackets,"I'm regularly looking into health and fitness information, often trying to get specific answers that are based on scientific studies. Both ChatGPT and Bard are great for this, they can traverse hundreds of studies and I can get rather picky about what information I want, continually building on the context.

Brief example of questions from ChatGPT: (omitting answers for brevity)  
\- What are the benefits and side effects of taking L-arginine?  
\- Does citrulline have similar effects?   
\- What risks are there in taking citrulline?   
\- Those sound like mostly short term risks. Are there any long term risks?   
\- Are there any studies related to the first two risks?   
\- Can a person get the benefits of citrulline with less than 8g per day?

Brief example from Bard (hope that's OK here):  
\- Do deadlifts release growth hormone in the body?  
\- Did any studies use only one set?  
\- Did any of the one set studies take the set to failure?

I could have gotten all this information myself, but it probably would have taken hours of parsing large studies and looking for specific dosages and subject parameters. The new AI systems make this a breeze.",5,198
hagridandbuckbeak,Talk to it in Spanish,4,5
I_Am_Astraeus,"Documentation. Love writing code. Hate writing readme's. Just have it do most of the lifting, while making sure some important specifics are correct.",4,23
ovary-achiever,"I’m a lawyer. I use it to make my emails sound more professional and succinct. I also use it for research. It will direct me to the exact statute or case I need, as well as summarize it. It could be used to write a motion (I have tested it but would never use it to do so solely). I used it to write a resume. I used to point out all the signs my ex had of NPD when I put in some text messages. I used it for cookie recipes (decent). I used it for everything I used to use google for.",3,104
