username,comment,likes,word_count
PacmanIncarnate,"I think part of the perspective issue is that it’s actually really amazing for low-code people because it will suggest frameworks and tools to help give you direction and will help explain issues with code and how to fix it. With almost no python knowledge I’ve been able to put together functional scripts using libraries I didn’t know existed.

I’m knowledgeable enough to know that there’s a huge gap between a functional script and a functional program, but a lot of people just aren’t.",3,84
starfirex,I've been using it to write scripts for me to accomplish tasks in Google Sheets (and explain how to install the scripts).,1,22
wandastan4life,Are you going to sell that app?,1,7
Substantial-Luck2413,What apps are you making?,1,5
wandastan4life,"My confusion came from confusing prompt engineering with asking chagpt questions, lol.",1,12
halohunter,"Sure - it may come out as a feature of one the big low code platforms, to accelerate development. Kind of like they do templates.",1,25
Goose-tb,"It’s actually pretty valuable skill with ChatGPT. If you ask AI stupid questions you will get stupid answers. Prompt engineering is simply understanding what the AI can do and leveraging it to get the answer you’re looking for.

One simple example:
A lot of people in my company are asking generic questions like “how do I be a better manager” and getting really generic answers, then they stop using the AI because they assume all it does is spit out generic answers.


Instead, we’re teaching them to ask the AI to provide an answer that challenges the common narrative. Getting unusual answers that allow more creativity with the response.

Just one silly example, but prompt engineering is just a dumb way of saying “ask dumb questions get dumb answers” and providing tips to avoid that trap.",8,136
CasualtyOfCausality,"It's a silly term, but I read ""engineering"" as it is used in ""social engineering"" rather than mechanical engineering or audio engineering. 

""software engineering"" is used to describe webdev jobs, so diminution of the term isn't new.",3,37
ghostfaceschiller,"It just means knowing how to interact with the model in order to get the outputs you want.

It sounds obvious and stupid until you meet non-tech people who tell you they’ve tried ChatGPT and don’t see what the big deal is. Then they show you how they’ve tried using it and ur like “Oh, so the problem was you”.

Once you teach them a better way to approach the chat, how to think about what they’re asking, how they should phrase things, etc. the tool becomes a lot more useful to them.

There is obvs more advanced levels, but that’s the basic way to think of it",2,108
Proof_Title116,Sounds better than prompt manipulator. Though I’d argue the buzzword should have been “prompt coach” since that’s actually what you’re doing - coaching the language model to output your desired response.,1,31
gh0rard1m71,Well chatGPT can't answer that 😆,3,6
WoSoSoS,This is conversational Reddit 😉,1,5
Falconstarr07,Thanks!,1,1
loshunter,"True, but once GPT 4 came along my ""googling"" has tanked. It's so much easier to ask the chatbot my specific question and get an answer that is actually 100% relevant to the thing I asked, instead of having to scroll through a bunch of links to sites that MIGHT answer my question...",14,53
SomeProfessional,Do you need to do more complicated thing with it. Like getting more insight from the internet?,1,17
nikleson79,And in the real world how many people / companies do that?,1,12
AmazingAdvantage8498,Your comment reminded me of something I once read something along the lines of refuting the typical ‘Knowledge is power’ line and then someone said ‘Applied knowledge is power.’,3,29
greywar777,"This so much.  I absolutely have a winning idea, but getting it too markets more then i can do alone.  Ive been debating creating a couple examples and a mockup.

Bit the i realize its going to take more timenthen i have left.",1,43
Whazzahoo,I’m so glad it worked!  You’re super awesome!  This saves me so much time and energy.,1,16
sushislapper2,"I’m not sure what part of what I said is “absolutely untrue”, but some of these are good examples of ways to use it productively. This is what op asked for, not your first reply

Some of these bullets are still clearly fluff and there’s no reason you shouldn’t have done just as well without it in the same amount of time.

You should have used some of these in your original response instead of filling it with writing poems, presenting recipes, tracking down family lineage….",1,86
Hankarino,My HOA experience versus my non-HOA experience has been worse in terms of people maintaining their yards. People in decent areas will just manage their own stuff when they’re not paying extra fees for an organization that pretends to enforce standards. It’s a scam imo.,4,45
ohgoodthnks,"That’s exactly where my struggles with grammar and syntax come from, I grew up learning English from non native speakers (my parents). Add my new medical disabilities that can create some serious brain fog with proper word recall ( example: yesterday said shadow, when I meant shade)  Now I can make those mistakes and let gpt find it for me.",2,60
Something_morepoetic,In a writing class you need to use your own idea and your own work.  Do you really want people in our health and business workforce who can’t think for themselves?,0,31
belefuu,"Yeah, that’s what I meant by “rightly” amazed. It will already, today, take someone from no/low-code, to writing code that would have taken them… weeks?… months?… years?… to learn how to write the old fashion way (boot camps, online lessons, Google and Stackoverflow). All depending on prior knowledge and complexity of the code, of course.

That’s a legitimate leap in capability for… almost all people. It just doesn’t yet scale to a certain level of problem in the way that lots of people seem to think it does.",1,88
Goose-tb,"Not this specific app, this was a proof of concept to see if ChatGPT can help me get an app on the App Store. So far the answer is “yep”. It’s a stupid app, admittedly, but conceptually knowing ChatGPT is helping me accomplish something I didn’t have the skills to do on my own is really mind blowing. 

As another person mentioned, for Engineers at my company ChatGPT isn’t super beneficial yet because it can’t see the full context of our product code. But we are testing GitHub Copilot and the results have been very positive so far.",2,98
Goose-tb,I’m making an app that has horses scrolling across the screen and you drag a tranquilizer to pop them. If you must know..,2,23
Blergss,"Exactly 💯!  Eventually there will be university/college courses for AI prompt engineering/knowledge etc. It will be the next major asset to have/know soon! 
Happy I've started to learn now from others exp and my own tinkering the past couple months now. 
Kept hearing about this chat-gpt stuff and happy I checked it out sofar. I haven't tried gpt4 yet but will eventually. Or hopefully it becomes free too like chat-gpt 3.5 on openai",2,73
SteveWired,Can you give a specific example?,1,6
BoomkinBeaks,"GPT won’t recommend a windows and siding contractor near me. If GPT helps those yellow page style websites, it is doing its job.",1,23
DirtCrazykid,"Eh, using a chatbot for information gathering seriously rubs me the wrong way, so I've forced myself to never do it",-1,21
HomeStar182,"I could certainly ask it additional questions, but that’s all I needed for this moment. I’ll probably keep pulling in additional insights after I verify with my boss :)",3,29
angelleye,"Well, since Agile and Scrum have become so widely popular, I would say ""many"", but I can't give any exact numbers.

The only direct experience I have with another company doing this is with PayPal.  They follow it very strictly, almost to a fault IMO.  

They create a sprint, and they simply do not add things to the sprint once it starts.  So they aren't as ""agile"" as the name would imply.

It does help them stay focused on their absolute top priorities, though.",2,84
charaznable1249,Good luck! Anything we can do to get past those bullshit resume filters.,2,13
PeaceLoveAn0n,"I've used it to send numerous emails and letters out to these kinds of things. I'm so in love with the extra time I have now, even with sending 10x more than I could before.",2,35
goldiegoldthorpe,"It’s part of a larger con that only Americans seem to fall for. “Taxes are theft” but “Fees are good.” It’s strange. Just call a tax a fee or tip and Americans are like, well, that’s necessary. But call it a tax and they foam are the mouth. Americans will pay more money out of their checks than anyone else so long as it gets divided into tiny privatised piles that are ineffectual at providing services. They really bit hard on the privatisation scam.",1,84
TheCrazyAcademic,"People don't think they literally have created complex projects with it as in hands on experience, last time I used chatGPT for coding I was working on an advanced stylometry bot to identify people's alts and potential identities based on their typing style. It told me everything I needed to know about what types of features to extract in a message like punctuation marks entity lists nouns etc then do things like semantic analysis and weigh averages using likelihood scores. Took a lot of prompt chains but overall everything was verified correct. If it can make groundbreaking programs that some would consider CIA or NSA tier then the people complaining are 100 percent just using it wrong. Before GPT it would take hours of researching scientific journals and obscure concepts and with it's help it does all the research for you and you just have to plug everything in together very little editing has to be done on the person's end.",1,161
Goose-tb,"Sure, I’ll provide one simple one I use a lot. I can provide more if needed.

If I’m writing a document that I KNOW will be seen by corporate legal, I’ll run it through our OpenAI service (Azure) and ask it to specifically critique the document as if it were impersonating a corporate legal employee. I’ll also tell it what industry we are in and loosely our company size.


Asking the AI to take on a persona and provide opposing ideas helps me prepare for questions I may get asked by that team later. It also provides more nuanced answers than just asking “what are the legal issues with this doc?”.

Also, I’ll ask the AI to provide me a list of questions in table format that it might ask me.

**BONUS ROUND**

When I’m thinking of introducing a new process to my team, I’ll ask the AI to provide *uncommon* feedback from an employee perspective, or ask for feedback that challenges a specific narrative. It helps me understand what might be concerns for my team like “the objectives of this process are ambiguous and open to interpretation which might lead to low adoption among the team”.

Then go a step further and ask the AI what suggestions it has to reduce ambiguity and increase the viability of the process, or suggest 3 alternative processes if it doesn’t think the current one is ideal.",4,234
penzrfrenz,"So ... as much as I generally avoid doing this, since we are in a thread that's basically about correcting peofples, I think this is one time it's ok.  

""Could of"" is wrong.  ""Could've"" = ""could have""

You probably are a polyglot that speaks 18 languages, of which English is your fourteenth and thus not very familiar.  I get that.  But this is one of the grammar mistakes that I think is both amateurish and avoidable.

And you didn't even have to Google that.  ;)",0,85
Substantial-Luck2413,Screw chatGPT!,-1,2
Whazzahoo,"That’s fantastic!  Now you have more time to be creative, which is what is humans do best!",1,17
Something_morepoetic,This comment is both funny and sad due to what I actually do.  I have a Ph.D. In teaching and learning processes for one.  I’m pretty much all in to help people have seconds chances in life.  Good luck and go in peace.,1,43
Fat-sheep-shagger-69,"Dude, you spelt people as ""peovple""...",6,6
DegeneracyEverywhere,*people,1,1
penzrfrenz,"Snicker - thank you.  The  irony is there.  Ok, fixed.  

Having said that, I would argue that there is a difference between a typo and an error that indicates a core grammatical errer.  

;)",1,34
Something_morepoetic,Best of luck to you.  Go in peace. ❤️ Edit: and I 100% agree with you about universities.  Absolutely correct.,0,20
AutoModerator,"**Attention! [Serious] Tag Notice**

 : Jokes, puns, and off-topic comments are not permitted in any comment, parent or child.

 : Help us by reporting comments that violate these rules.

 : Posts that are not appropriate for the [Serious] tag will be removed. 

 Thanks for your cooperation and enjoy the discussion!


*I am a bot, and this action was performed automatically. Please [contact the moderators of this subreddit](/message/compose/?to=/r/ChatGPT) if you have any questions or concerns.*",1,74
FlowSilver,"I use it to explain me school/uni concepts and random life questions

While i never copy and paste its answers, I find it explain things better than (some) teachers and still (mostly) correctly

It can especially help with open ended questions by offering perspectives I never thought of, giving me new ideas to then properly research",467,56
Adrastosz,"I have a very curious mind and love learning new things. So knowledge of any kind and for questions.

Perplexity has basically replaced Google for me. It 9/10 times within two answers tells me what I need to know. Instead of Ads Ads Ads and shitty SEO writing.",157,48
SouthwestBLT,"I live in a country where I don’t speak the local language well; translation apps often give me overly complex translations for phrases due to the significant difference in sentence structure between English and Japanese. 

With GPT I can ask “what’s the simplest way to explain to my neighbour that im locked out in Japanese” and get a translation that is focused on communicating the message in its most basic way. 

It’s a real life saver honestly.",130,77
ZookeepergameSea1130,Writing descriptions for stuff I'm selling on fb marketplace!,63,9
roryseiter,Making limericks about my friends.,39,5
AndrewMurphy1992,"I've started coding since 3.5 came out, and asked me if I would like to code. We wrote some simple terminal games in Python, and then I started inventing things with them. It's been great.",77,35
azimuth_240,"I use it to write VBA to automate my work in excel and AppleScript to automate the rest of my job. I have probably 15 different excel macros that I have written with ChatGPT that pretty much clean up data using user input and built in logic. I use AppleScript to automate system level functions like moving and saving files, sending job updates via email. I am also learning python with ChatGPT. My workflow is:

-Explain the problem/bottle neck/pain point in detail to ChatGPT and ask it to repeat it back to me to make sure the issue is understood. If well understood then “please store in memory”

-ask ChatGPT to formulate 5-10 questions regarding the problem and solution 

-answer these questions and ask it again to summarize the problem as it understands it. If well understood then “please store in memory”

-if problem is well understood move on to next step if not 5 more questions and answers this time be very specific. “Ask me any relevant questions about my file structure or operating system….”

- some times as this point I will ask it to clarify nomenclature.  Example : It sounds like we will be using a formula can you tell me the names of each argument used in this formula so I can clearly reference them in a way we both understand stand. Drill down on this hard because clear verbiage will be critical in formulating the final prompts.  

- please out line three approaches we might take to solve this problem. Then I will pick the one we will try first.

-formulate final prompt

From here it is just troubleshoot and drilling in on the details. Basically anything at my work that I have to do more then twice a week and requires more then 2-3 steps has been automated this way. I even had it help me program a QMK keyboard so everything just runs on a single button press. I’m convinced the folks complaining about ChatGPT not working well are using poorly constructed prompts.",38,340
DislocatedPotato57,"Therapy replacement. Chat GPT has given me more helpful answers and suggestions than any therapist I've ever had.

Music recommendations. I'll say something like ""If I like Karol G and Muse, what Japanese music would you recommend to me"" and I've discovered really good but very obscure/unknown music this way.",100,50
k815,I automated a good chunk of my work and told nobody.,32,11
Tofulinka,"I'm a programmer and gymrat and I use it for:

- shortening code, asking for unittests, questions about docs of various frameworks, questions about configs for various tech (Kube, redis, etc), writing automation bash scripts that I'm too lazy to conjure up

- nutrition recommendations, calorie estimates, tips for my workouts, questions about my body when working out

- tricking it into swearing then spamming 30 people with the screenshot (peak humor)

- game questions, if I'm stuck somewhere I no longer Google it, I chatgpt it

- emails, slack messages that I'm pasting into channels of thousands people always get a proof read from chatgpt

- creative gifts ideas by describing the person I'm trying to gift

- general life tips on sleep, mindfulness, cooking, fixing things etc.


I'd say I'm using it every single day, it's made my life 10x easier and I've been able to leverage my work performance, workout schedule and more",195,156
liukidar,"coding coding coding coding - man it's saved me so much time, especially with frontend stuff.",26,16
RunningM8,"I’m a project manager and have ChatGPT summarize large docs for me (contracts, software agreements, white papers, etc), create first drafts of process and PM artifacts and the like. It saves me 4-8 hours of work weekly.",88,37
StonerProfessor,It’s kinda replaced Google for me and I’ve also been using it to help me remember things for work.,19,19
LeftAdhesiveness0,I started a text based RPG in a post apocalyptic setting - like fallout.,20,14
iamthewhatt,"I am a disgruntled, underpaid Millennial who wants to escape the rat race... So I am using it to learn coding games. But I have pretty severe ADHD, so it's very hard. Tried Unreal and Unity, but it's so complex I just get burnt out before getting anything done.

But with the recent updates to Godot, I found the Python-style coding engine WAY more forgiving and understandable and have actually progressed. Plus the new Memory feature allows me to set very specific-to-me instructions that makes GPT's responses WAY more readable for my distracted-ass.",18,93
adarkuccio,"Ask stuff that is not easy to google, help with some work",16,12
Critical-Elephant939,I use it for writing and D&D prep,41,8
FLSince1929,"First, this is a fantastic thread. 

Here are my primary uses and some interesting ones:

*  Clean up outbound emails for clarity.
* Explain a concept that I need more detail on.
* Helped me draft a business plan
* Created process list for many of my businesses processes and helped me clean them up.
* Brainstorm ideas for alternative and non-standard ways to find niches in my business. 
* My daughter and I use it to create boardgames ideas from roughing in to rules design and have had some amazing successes. 
* Personal mental health counselor when feeling down, confused or suffering from anxiety - it really is as good as  a human counselor.  (in my opinon) and always at my beck and call. 
* Creating and altering images in Dall-E (although I still prefer Midjourney)
 
That's about it now, but I'm going to keep going through this thread to see some of the other great ideas.",12,158
Aware-Meaning-3366,"I ask it questions about how to create a self sustainable farm to serve a community of 3,000 houses. The goal is to create a super power community of 3,000 houses and most in the community to become individually financially free and empowered.",12,43
vujade762,"People/tech manager here. 

- I use it to help me come up and then write evaluation comments and goals. 

- write job descriptions 

- come up with interview questions based on the job description. 

- (something new I’m trying).  After removing PPI on resumes, drop the JD and other requirements and then upload resumes and have it rank candidates, look for red flags, etc.  

- help me draft emails, proposals, (any writing really)   

- one of my teams does our training.  We use it there to scaffold our training (it builds the agenda essentially).  

- I take emails from really techie members, drop it in there and ask for it to summarize it for me like I’m 12 years old.  

- (just did this yesterday and it’s been far my favorite use of GPT although I’m finding character.ai better for it.). I use GPT to come up with a character profile (background, way of speech, philosophies, etc) and then copy that into character.ai and create a persona for me to run ideas against.  My favorite have been Tyrion Lannister and Cersei Lannister.   Add in books summaries from books like the Prince, 48 laws of power, 33 strategies of war, Sun Tzu’s art of war, etc).   I feel like I have the best advisors one can have as I work in a very political environment.",13,224
TheRobotCluster,"I use it as a shortcut past mental blocks of any kind.

1. I’m writing a song and know I want a line to have x, y, z characteristic but can’t find the right wording to fit the rhythm, the feeling, the message, etc. Brainstorm with Chat to figure it out

2. My girlfriend and I aren’t seeing eye to eye on something, spill the detailed context of both sides to Chat and get 10x more clarity insanely fast

3. Want to have a professional conversation with someone for career purposes but don’t know how to approach it. Run through as many “what if’s” and “what-about-isms” with Chat.

4. Feel like I don’t know something I should or that everyone else seems to know, learn about it from Chat without judgement and ask 1,000 “what’s this” and “why” questions like I’m a kid again.

5. Need a car/home maintenance appointment and I actually wanna know what’s going on enough to have an intelligent conversation with the mechanic or repair guy. Have a crash course conversation with Chat to build that confidence-through-competence.

6. My family or friends are going off in a conversational direction I don’t understand and I don’t follow along but I want to without breaking their flow. Have Chat’s transcription feature (microphone icon, not headphone icon) listen to the conversation for me for a few minutes then I’ll ask “what are they talking about? Can you catch me up so I can follow along?” And then it does and then I’m back on track and able to engage.

Once the new voice feature comes out where it can change the way it talks and be naturally interrupted, I plan to use it more as a language partner for learning other languages. I could say “slow down” when it speaks the other language. I could stop it at the point I don’t understand rather than it continuing and letting confusions build up.",13,323
Successful-Muffin-29,"I use it like I’d use google but I just like that it gets to the point, but then with some stuff I have to look it up on Google just to make sure it isn’t making shit up and I think every time I’ve double checked it’s been right.",10,50
Schkeiner,Grammar corrections,22,2
