username,comment,likes,word_count
Environmental_Pay_60,"Im a newly taught programmer and after 2 years of school it still isnt coming natural too me.

With gpt i got a sparring partner. I made a tab and posted all the recent documentation for new Angular  and rxjs features and it helped me immensely getting into it.

But no, i dont ask it to code stuff for me. I ask stuff like ""how should i approach this situation x, coming from this prior standpoint y, preferred using technique z. Please explain the process, why doing it this way works and provide a link too the documentation"".


The link is almost always outdated, but i can usually find it with some googling.",1,113
allvys,Hooking into the Matrix,1,4
allvys,"I'm struggling to get a job in my field of advertising/graphic design and so at this point I've been using it to create cover letters, resume variations, etc just so I could churn out more quality applications.",1,37
mrplottwistaa,"I use it for everything, recently I used it to help me choose to get a dental root canal or extraction and gave it my budget",1,26
Hot-Ad-6967,"Chatgpt is pretty cool - she can turn the transcripts into written essays. Chatting with chatgpt is actually good for your mental health! It's true! If you've chatted with chatgpt before, you know what I'm talking about. Honestly, I'm kind of curious to learn more about all the amazing things chatgpt can do.",1,53
-anaminflame-,Getting answers to long questions and projects or any text from friends and rewording to to prevent plagiarism,1,18
interstellar-travels,For planning and daily work.,1,5
TheInkySquids,"Getting the motivation to do things that don't interest me. The ADHD I have seems to mainly affect my ability to start projects I'm not interested in. I have no problem with projects I am passionate about and I often hyperfocus on those, and even with stuff I don't enjoy, once I get started I'm usually okay. Its the getting started that I just can't do, and ChatGPT is great at that. I often ask it to write reflections for my college projects because I hate those and don't gain anything from them, and I also feed it some of my past reflections to emulate my writing style. Even if HALF of what it spits out is too bland or just plain wrong, that's still an incredible starting point that might've taken me DAYS to get done. For the first time in a long time I actually feel like I can kinda function semi-normally and meet expectations!",1,157
fashionkilla91302,"I work in sales and use ChatGPT to help me build sales materials. 

It’s been a game changer.",1,18
JeffDeChef,I get it to answer my emails,1,7
Negurdesheils,I use it to fly kerbals to the mun with kOS. Jebebiah aproves,1,13
iJoltik,DIY Tech support instead of waiting for our tech support to answer.,1,12
Elevendaze,I use it as a creative tool. I’ll give it a prompt and then use the output to prompt my own creativity. It’s a great brainstorming tool.,1,27
some-dork,"i'm a hs senior and use it to understand difficult topics for my classess. i just ask ""please explain x topic to me like i'm 5 years old,"" followed up by ""thank you. please walk me through a simple example of a question based on this information,""


I can then ask more info from there. its very helpful for learning new topics, especially with ap exams this week",1,68
bshameless,Using it to learn python,1,5
Zealousideal_Set_333,"I use it every day at work.  I'm a civil/environmental engineer office worker.  It helps me clean up and refine text written on deep subject matter, helps me brainstorm answers to questions and refine my thoughts.  Performs excellent, but it doesn't do all the thinking for you.  You have to understand your problem and prompt ChatGPT to lead it in the direction you envision.  Really good for bouncing ideas back and forth as a sounding board. Improves my technical writing significantly.  I honestly use it for many things I would have used to Google, as it synthesizes the information on deep subject matter questions that would have taken hours of hunting around the internet for in the past.  Helped me create some very inventive and creative ideas for engineering work projects.  I learn new information so quickly with AI that used to take so long to compile.  Great tool, I think a lot of professionals will benefit greatly from having ChatGPT or similar AI in their toolbox.  Most of my coworkers haven't even tried it yet though and have as lot of misconceptions and just haven't learned how to *really* use it.",1,192
Nefalem_,Answering job applications with bullshit questions. And using ChatGPT to write the must convincing answers of a job I have no idea about the job description. I just want the money.,1,31
Infamous_Average4584,"Ive used it on occasions to write emails for me, also some home assignments from school and stuff.",1,18
Alphafox20,"Honestly, i use it to help me draft emails. Especially helpful for those Messages that need to deliver a lot of information while still being concise.",1,26
abhilashjoseofficial,"1. Checking Grammar  Mistakes
2. Rephasing content especially shorting wordy sentences
3. checking errors in my code and checking the reason for that and also checking alternative solutions.
4. additional information regarding any topics

and sometimes if the topic is too big to read then I use to summarized points",1,50
Salt-Ostrich8625,I'm learning Python and ChatGPT is my saviour when I'm stuck at some problem.,1,14
TheCleverCrumb,"I work as an SEO analyst so I use it for tweaking my website content and preparing ideas for the same.
I also used it to create a fairly basic website.

It also used it to study for my Master's. I passed.

This one time, I made it write a poem for my girlfriend based on our first meeting. She loved it but not more than I did lol.


What about you? How do you use it?",1,77
TheCleverCrumb,Thanks for this info,1,4
707sharon,"I'm one of the quizzers in our school's quiz society. Even though we create quizzes by hand for main Quizzes, we use ChatGPT to create weekly quizzes because our final exams are coming up and we don't have that much time. 

Also I use it a lot for studying, I ask about the topic, context I want it explained and what examples it should use. Very useful in studying Economics.",1,70
717sadthrowaway,"World building an alien civilization. Chatgpt is great for bouncing diead about biochemistry and planetary science. Its a great fiction writing sounding board, and had helped keep me engaged in the creative development process.

So far, I've laid out the prologue to a story where alien refugees arrive on a distant science station, create a moral and philosophical dilemma for the colonists.Chst GPT helped me figure out a lot of the research work that would have taken months -  orbital mechanics, hypothetical biochemistry. I do have to check it's research pretty often because it gets confused with chemistry sometimes, but even when it's wrong I learn something by spot checking the research.

 Basically its like having an on-call research librarian, which is funny because that's my job!",1,127
NonSpecificKenobi,"I used it to help me write a bot for my groups Discord server.

I used it to modify a workflow I found on Youtube for voice notes to summary and action points (all of which actually goes through the Whisper and ChatGPT API's so I guess for actually running the workflow as well).

I use Obsidian for notetaking, which uses markdown, and often find it easier to explain a template to chatGPT and get the markdown properly formatted from that than doing it all myself.

Am also playing with how to use it for summarising articles (I work in scientific sales) and podcast episodes but I am not too convinced about the workflows I have seen so far, or if this is asking a little too much of ChatGPT accuracy wise.",1,132
Waiwirinao,I ask it to make condensed versions of books I want to read but dont have the time to.,1,19
mymeepo,I use it for statistical coding and editing text almost daily,1,11
thebitchymermaiden,I use it for cover letters or generating a phrase when I'm stuck writing,1,14
TheRtHonLaqueesha,Helping me write creative fiction.,1,5
Telephalsion,"I am a teacher, and when my colleagues are swamped, but I still want second and third opinions on papers, I feed grading criteria and assignment instructions into chatGPT and ask it to assess based on that. Usually it confirms my assessment but sometimes it rates differently which prompts me to re-read the assignment to see, sometimes I agree with the new assessment by the AI, other times I disagree, but it is helpful to bounce off of when a human cannot be found.

It is surprisingly still slightly slower to feed criteria and texts into the AI than just reading and grading myself though. And sometimes chatgpt can assess the same texts in wildly different ways given the exact same input, so it isn't something I can lean on to reduce my workload, but as a sounding board, it works well.",1,142
BigDicks99,Almost all of my university assignments and lectures,1,8
DawidIzydor,I do a lot of summaries. You can prompt it a paragraph or two and it gives you point in point summary which is very useful for longer articles,1,29
CovetedPrize,As something to talk to.,1,5
Life_Detective_830,Creating my own assistant.,1,4
razzaxxe,"\- Reports for work (i am a therapeutic practitioner)

\- Holiday itineraries

\- Book summaries and key points

\- Creating meal plans and exercise routines

\- Proofreading

\- Legal advice

\- Product recommendations",1,33
Novel_Initiative_937,"Gpt4 is great at Python. Of course I know the basics and I am able to fix the code here or there, but mostly I was not able to programming from scratch (I don't even know the syntax) but I was surprised how much I could create with it",1,49
Rawvik,Used it to write a sweet poem for my fiance's dog yesterday who is old now and sick due to age. She was very sad so I am gonna make a custom video of her dog with the poem and send it to her. Hope that will make her feel better.,1,51
No-Grape621,"I use it to proofread my writing, and as a tutor.",1,11
ProgrammaticallyYou3,"I work in an HR Management company, where one of our projects is hiring of resources for a Government Bank. So, for every candidate that we interview, we have to write an entire 1 page curated report comprising of their entire work details and their screening interview assessment.

So, around 5-8 reports per day per person working on that project. And GOD we hate this project. 

So, what I've started to do is to copy paste their CVs to ChatGPT and get a summary of their work details under 100 or 50 words. So, whatever response I get, I paste it back and adjust it there, add the couple of lines of assessment and DONE.

The issue that I seemed to have solved in my (and several others) case was that I have difficulty in converting bullet points to a story like narration which consumes time, especially when we are also working on other projects as well. In this case, I can take the generated summary, readjust it to the decided format, and add anything that ChatGPT might have skipped over that I feel should be included, and I've saved time and my brain from short circuiting.",1,197
Marten_Shaped_Cleric,I use it to help me with Unreal Engine 5… though it usually has 0 clue what it’s talking about. Pretty sure there aint enough training data on ue5 yet,1,30
black7acea__,I use chat gpt for know lot of things about i'm curious !,1,13
STUDBOO,"I use it like Google, but different.

I have chatgpt plus, so it is faster and better then Google.

Now, I just say like gpt it.",1,26
sausage4mash,"Coding mostly, I'm hustling",1,4
Qeuzee,"I talk to it about my my conlangs and alt history projects, I sometimes ask for help with those things too.",1,21
Nerozar,Sex Storys 😬🙈🤣,1,3
Training_Age_Reed,"Just yesterday I formatted a dataset with chatGPT, giving it 3 lines as a sample, it did a great job. My mom got a recipe for ciabata bread, and told chatGPT to double it, I also used it to write a poem for my aunt, she loves warthogs, and she loved the poem. I read about the Voyager missions and asked questions, learned about the Interstellar medium, and about the data the spacecrafts are still sending back. I also got some good advice about singing.  It is not a toy anymore, this was just yesterday, and more. I see myself using it a lot in the future.",1,107
KeterClvss_ptrnscmr,https://preview.redd.it/qwqk90qb48xa1.png?width=1080&format=pjpg&auto=webp&s=0fcd5a8b97cec4fc532148b5793e6e0b14cacd51,1,1
Vishnu_8,I use it for coding assignments in college 🤡🤡,1,9
LoudWolf,I mainly use it to summarize cooking youtube videos into recipes based on the caption (as they rarely put it in the description). This way I don’t have to keep rewatching videos while cooking and I can save the recipe to my notion database. Definitely saves me some stress,1,49
Veylon,"Writing terrible fanfiction.

Also python code for various projects.",1,9
Tom_Raftery,"I use it to help me generate social copy for my podcasts. I’ve seen my podcast monthly downloads increase by 60-70%
I feed it the podcast transcripts, and have GPT4 write show notes, titles, hashtags, blogs, LinkedIn posts, tweets, and occasionally Instagram posts",1,43
Appropriate_Grand170,Exams,1,1
tase6ix,Business and research,1,3
DarknessBBBBB,"I spend more time debugging the code it writes than writing it myself, so I mostly use it to write down emails for me lol",1,25
charge_2020,I use it for programming,1,5
WhamPhiobic,As a college student homework and studying,1,7
endless286,"it was actually extremely helpul for me when i have a fight with my GF... I literally write  what happened and ask tips on hwo to make it constructive and follow it. it reminds me to keep her point of view and focus on listen, to make sure to not be accusive, start by remidning her i love her, and much more. has been very beneficial twice already.",1,68
Stanseas,"I use it for writing javascript, css, powershell scripts, AHK and stuff.  
Today I got it's help to write a powershell script that checks my computer (with defined inclusions and exclusions) for broken shortcuts gives a numbered list and gives options to delete (A)ll, (R)ange, (L)ine item or (D)one.

It was tricky because I had to run it as admin then use a powershell command `PowerShell.exe -ExecutionPolicy Bypass -File C:\PATH TO PS1 FILE\broken_shortcuts.ps1` or run into permission issues. I couldn't get it to stop looking in directories I still didn't have permissions in like SYSROOT stuff so I just filtered those broken links from the displayed results.  
I learned a lot today, especially how to not depend on ChatGPT to come up with creative workarounds. Every time I asked it to it ruined the previous attempt rather than only modifying individual lines necessary.

If I had permission I'd share the file. :)",1,152
Mazyc,Macros and writing / rewriting stuff.,1,6
harry_d17,"https://preview.redd.it/i4zgky6in8xa1.jpeg?width=720&format=pjpg&auto=webp&s=9bcebf4920188d35e6ecae21faa41de134bd21f0

I mean that's what I use it for.....💀",1,9
gladwrap1205,"I use it for studying all the time. I have a checklist of what to study, and it makes notes to revise through and also asks me questions. It has been fairly accurate, but I find it to struggle when writing essays and such. It's still a wonderful tool I use every day for studying",1,55
EntertainerSuper6675,I use it sometimes for SAP relevant technical questions. 50% of the answers are usefull,1,15
bonstockage,"I’m using it all the time now, as a creative partner for branding and marketing sessions - and for cross referencing the  ideas in other languages and cultures (to make sure its not something bonkers and offensive when translated! It’s incredibly effective.",1,42
bigteddyweddy,"I use it as my assistant while I am coding, I’ve been making websites for 20 years and V4 is amazing for support when working through a problem.",1,28
Living_Stand5187,"My main use is sorting biases, I’ll feed it a long comment chain, ask it where each comment goes right, wrong, the biases they might have, etc

To overtime gain a more unbiased and nuanced approach to discussions",1,38
AndreasE89,"I mostly use it for asking programming questions if I'm curious about something I'm going to do or currently doing, mostly for boilerplate code and tests, but I don't take it too seriously as it has a tendency to create non existing libraries or just be blatantly wrong. It is nice for just idea bouncing though.",1,56
waterpigcow,"I use it for coding, i use it for resume doctoring and drafting cover letters. i also use it to structure stories i write in my free time, brainstorm ideas an generate things.",1,33
Realistic_Peace_6310,"Proof reading my scripts and asking for suggestions, sometimes making sure what I write is correct before I even test it 😂 such a clever tool 😁",1,27
GroundbreakingTone43,"Boost my learning on a bunch of fields that i love. Electronics and coding are fun as hell. Me and my kids are opening a lot of old devices in the house for parts and asking about the components, what is it, what for, ""now, go in depth"" and we learn even more about it. ""Show me a Robotics example using this"", ""Show me a IoT example using this"". Loving it.",1,71
Lectoras,I ask it to make a vegetarian food program for entire month with every vitamins I need,1,17
Dull-Two2347,"I use it to write stories, specifying random things 
It's very funny 👍👍",1,13
shmarps,"Letter to landlord to take over past electric bill fees. 

Drafting up interview questions for technical positions.

Coming up with an agenda for a team offsite. 

Asking it how it would build other ai tools for our business",1,38
GeanM,It helped my mother create a personalized lesson plan for each of her autistic students at a charity institute here in Brazil,1,22
TheBadWolf1903,"Helps me develop all sorts of documentation for videogames, stories and other media projects. My hopeful plan is to one day lead a team to make fun and grand projects of media entertainment.",1,33
OrganizationNo4782,"I did my entire pg project with chat gpt 
I don't know whether to say I cheating or I'm smart",1,20
Mikefacts,"I use it regularly in my software development job. I feed it which necessary information about the project I'm working on and then start to ask questions and ask for code implementation and it really helps. The code it provides is not always correct, but with additional tuning from me, I produce the best quality code.",1,56
Illchangeitlater-,"I am level 2/3 help desk. I put in my trouble shooting steps and have it format my documention. Also if I am unfamiliar with a common system I will put in what I know and it will give me troubleshooting steps. 

I have also had it format SOPs that I could then confirm then give to users.",1,58
Gaz042,I use it as an early stage beta reader. I give it my first draft and ask where the writing can improve. It's given me great feed back.,1,28
Wtf_cant,I use it when conversing with my ex,1,8
felicehundred,This is great help in book writing,1,7
dan_danut_danel,Standard operational procedures elaboration and verification,1,6
Ampersand_1970,"Brainstorming, drafting emails and letters, creative briefs, summaries, research, developing strategies, playing devils advocate, mid journey prompts and sometimes we actually chat… better listener than my wife",1,27
SirRaiuKoren,"I use it for quite a few things, but unfortunately, until issues with AI copyright get sorted out, it unwise to share them on a public forum. Not that what I am doing is copyright infringement, but rather the opposite; it is possible that by using chat GPT to help me write some things, what I have written cannot be copyrighted.

EDIT: This was the advice of a copyright lawyer. They told me not to publically discuss my work until the courts sort out AI and copyright, just in case.",1,90
Weekly_Department560,"Buying Crypto, bro!",1,3
ComfortableCover2891,Bak,1,1
GamerBeardie426,I use it to write short stories and edit my fanfics and original stories,1,14
RobertJCorcoran,"Grammar check since English is not my first language, and you never know what you could have missed here and there.   


""ChatGPT, Grammar check on this message: <Grammar check since English is not my first language, and you never know what you could have missed here and there>""  
""The grammar in your message is correct!""",1,55
gq244,i use it to rank netflix shows by imdb rating,1,10
Galalalalalalalala,"I'm using it in my business to cut down on time, and do things I can't afford to outsource or afford professionals for yet.

I never get ""stuck"" any more. Any time I'm writing a message or email and it's taking longer than 5 minutes I just put a summary into chatgpt and it crafts a professional response that usually says everything I need to say.

It writes all my business social media posts. I also use dal-e for funny images to go along with the text. It also writes replies to feedback and reviews when I can't think of another way to say ""thanks for the lovely review!"".

It has helped me craft an seo plan for my website that is actually helpful and achievable. Fingers crossed its effective too! It appears to be pretty good at advising on seo and chatgpt4 is good at generating suggestions beyond the obvious ""create content"" type stuff.

It is not very good at writing product descriptions as they come out very repetitive, but given appropriate guidelines it can change a description to be for a different product - useful for me where I have multiple similar things for sale and need the descriptions of each to different enough that google doesn't declare it a duplicate.


I'm currently working through learning how to automate various repetitive tasks in my business, and chatgpt has been pretty useful here too. I tell it what I want to do and it is usually able to advise on how to do it. Sometimes it gets things wrong but so far it's mostly good.


For me, it's most useful for situations where I want to emulate what the bigger companies are doing. For situations where I need to do something new and different it's less helpful, but it is a fantastic time saver for just about everything else .",1,311
Firama,"Just last week at work, I was doing a trial for something. I had written a bunch of notes, and wanted to write a report. I input the notes into ChatGPT and asked it to write a report with the headings I wanted, and it did it pretty well. I had to rewrite about half or more but it still let me write a decent report in about half the time it would normally take. I often find that the hardest thing is to get started while staring at a blank sheet. Using ChatGPT puts something on paper and I can sort of edit it instead of writing 100% from scratch.",1,111
Strange-Welcome6594,"I'm a digital marketer, so I use it for everything basically. Copywriting, content ideas, fact checking, unblock creative ruts etc.",1,20
Particular-Ratio3025,"I use it everyday for everything: I had it help me design an efficient kitchen in our guesthouse, rewrite my business plan to be more effective with my time, create an outline for sales copy to increase conversion rates, clarify my business niche, create wekely menu plans with grocery lists, write out a month by month calendar of tasks to implement my new business plan, create a script for my Discovery Calls for potential clients, improve my relationship with my son, run a personalized graywater system for the clay disposal sink in my studio, organize that same studio for efficiency, help my daughter find a job, and created a marketing plan for a friend’s flower farm business. I can’t believe I actually tried to live a life before it. What a peasant, I was.",1,134
Jablko_Official,For my homework,1,3
Sh-anta-nu-13,I use chatGPT for the essay writing. It's way to boring to write essay and chatGPT is doing that job for me,1,22
tkvg,"I use it a lot. more than I thought I would. Its faster and more reliable than asking google or duckduckgo. My birth mom is romanian, in my twenties I found her and there has always been a language barrier, especially since she is uneducated and her grammar is awful, any other online translator just does not work.. now with chatGPT I can translate what she's saying reliably. I have it give me an exact translation followed by two interpretations. being able to suddenly talk to my real mom is surreal.

I have a word document on my desktop filled with instructions that I copy paste to chatGPT.

If i come across a problem in a video game, asking chatGPT is the fastest way to get an answer. 

My dog got skunked recently and chatGPT told me which household products to use.

Its great for cooking recipes. if you only have specific ingredients itll make a recipe for you. Gone are the days of googling a recipe and having to subtract or substitute ingredients.

You can ask chatGPT for passages or quotations from old roman historians or any author and site the translation version. Majority of my time on chatGPT is going down history rabbit holes.

Word games. I made up a word game where the objective is to defeat what the other person says. for example I say ""fire"" you would probably say ""water"" and then id say ""freezing temperature"". you can mention any know thing in the universe like people, places, ideas, philosophy, fictional ideas or time travel but cant repeat the same thing twice. I give chatGPT instructions for the game, open a new window with another chatGPT and have the two ai go at it. It gets very weird fast, into quantum mechanics and dark matter.",1,300
Gryphon962,I find it very useful for getting a quick summary of legal stuff as it has access to court decisions as well as legislation so it can give you the case law results as well as what the legislation says.,1,40
Money_Passionate-416,It got a me 90% average this semester,1,8
