username,comment,likes,word_count
frozen_note,how does it help u to remember things?,4,8
Spiritual_Case_9302,how did you go about doing htat?,1,7
Honest_Lime_4901,Hey I heard that the AI chatbot Nomi was excellent at this sort of thing because you can create many companions,-3,21
teedyay,"I feel I can ask questions that I don’t know how to ask. “I’m working with X; I don’t really understand Y; is something like Z possible?” ChatGPT says, “It sounds like you mean A. You can do this with B.”",9,41
circles22,It’s so good at D&D prep. It can fill in the details of a scene so nicely.,13,17
-Posthuman-,"I’m wondering how well the new vision/conversation capabilities would work if you had the camera pointed at a battle map with minis.

Could it be used to play the NPCs in a combat I wonder? As the DM, it would be cool to just let an AI drive the goblins or whatever. Then if a PC gets killed, they can’t blame me. :D",5,63
Marquis-D-Carabas,Second this. It’s hugely helpful to craft better descriptions of places and things than I ever could. Great at homebrewing magic items and pretty good at creating images for things. I even started using it to turn my session notes into a short fantasy novel that I’ll share with my players at the end of our campaign.,3,57
Runnerbrax,"Dood. Same.

I have about 75 pages of lore for my homegrown campaign setting of the Republic of Iskandar.",2,19
Outrageous_Two1385,"Holy smoke, went on a mini adventure the other day! Chat was a pretty good DM.",1,16
The_Real_Pavalanche,"Same. I don't want it to do *all* the work for me, but if I write a short description of an environment, then ask it to punch it up and make it more interesting, it does a far better job than I can.",1,43
SophieSolborne,Same! Gone are the days of nameless/faceless NPCs when the players decide they want to ask a random shopkeeper their life story,1,22
Smack1984,"How do you use it for dnd prep? I’ve only used it to make NPCs on the fly, but that’s it",1,21
TricKTricK21,Just found out it can build NPC stat blocks. Full spells and everything. Insane.,1,14
AriesCent,Very Nice I also have it generate Press release template for the business concepts and even pro-forma presentation deck. It definitely helps remove analysis Paralysis!,1,25
Special_Hotel_2514,"Can you elaborate more on how you use GPT as an advisor by feeding it summaries of Prince, Art of War and 48 Laws Of Power? Like, do you feed these summaries and then the situation you are in and GPT advices you? An example would be nice.",1,48
GodsHeart2,I do the same for my book that that I'm writing,3,11
teedyay,"If the internet’s a library, Google’s an amazing librarian. ChatGPT is someone who’s already read all the books.",10,18
MrG,I had been going straight to ChatGPT to skip ads and hyper SEO’d content but then found an instance where ChatGPT’s answer was wrong - so it’s super important to check with other sources (typically still Google),3,37
EricHill78,I like to use Microsoft Copilot which is powered by ChatGPT when I have google type questions. It shows sources with its response.,1,23
emotional_dyslexic,Corrections of grammar\*,-1,3
useyourturnsignal,"> I have it search online for coupon codes when I check out. This isn’t the greatest, but it takes less than 1 minute and if I save 5 bucks I’m happy.

How do you do this? Take a photo of your loaded shopping cart and upload to ChatGPT?",2,49
IversusAI,"> I went around my house and took pictures of all my data plates on my equipment (stove, microwave, dishwasher, fridge, ac, hot water heater, washer and dryer, etc) and now whenever I have a problem, I put in the data plate and give a description of what i need. ie: attached picture of my microwave data plate and said I need a new light bulb and filter. It then searched a parts picker and found the exact parts that I needed, copied that part # into Amazon and got new light bulbs and filters for 20 bucks and it took less than 2 minutes. 

Damn, that is fucking genius.",2,110
blocsonic,Google needs to fear this sentiment instead of finding more reasons to pump ads into the search results.,1,18
A_curious_fish,"That's unique, haven't seen that response yet. How exactly? Just to refine your wording or what exactly",11,17
Noelic_vi,"Oh, I've done that. I got a really good remote job on the first interview of my life and it was even during my university exams. I used chatGPT extensively. I scraped all the data from the company's website and inserted it into chatGPT so I could learn everything easily by asking it questions. I held a mock interview for chatGPT and studied how it responded to my questions. It was a great help.",12,74
McSlappin1407,"Every time I try to do this it just gives me jobs from one resource like indeed and when I tell it to branch out and use more like LinkedIn or ziprecruiter it just spazzes out and doesn’t know what to do, it’ll give me the same listing or it will only use one of the other site options and give me a bunch of dead links that read “file not found”.. it’s got a ways to go when it comes to searching for jobs for me.",1,87
ZookeepergameSea1130,"I did something similar - I pasted in a job description and my resume and asked it to help me generate 10 questions for a 2nd interview, then I asked it to expand 3 specific questions from the list. It was super helpful.",1,43
A_curious_fish,Amen to that last part,4,5
nusodumi,"[El Capitan, a vertical rock formation in Yosemite National Park, California, stands at a height of approximately **7,569 feet (2,307 meters)**](https://bing.com/search?q=height+of+El+Capitan)[^(1)](https://bing.com/search?q=height+of+El+Capitan)[^(2)](https://www.britannica.com/place/El-Capitan).

[A Double Stuf Oreo is approximately **1.86 times** the size of a regular Oreo](https://www.nydailynews.com/2013/08/20/do-double-stuf-oreos-measure-up-high-school-class-conducts-yummy-experiment/)[^(3)](https://www.nydailynews.com/2013/08/20/do-double-stuf-oreos-measure-up-high-school-class-conducts-yummy-experiment/). [According to a comparison of different Oreo sizes, a Double Stuf Oreo measures about **14 millimeters** in thickness](https://www.extrabux.com/en/guide/7966441)[^(4)](https://www.extrabux.com/en/guide/7966441).

To find out how many Double Stuf Oreos it would take to stack the height of El Capitan, we can convert the height of El Capitan to millimeters and then divide by the thickness of a Double Stuf Oreo.

First, let’s convert the height of El Capitan to millimeters: 1 foot = 304.8 millimeters So, 7,569 feet = 7,569 \* 304.8 = 2,307,163.2 millimeters

Then, we divide the height of El Capitan in millimeters by the thickness of a Double Stuf Oreo: 2,307,163.2 mm / 14 mm = approximately **164,797 Oreos**

So, it would take approximately **164,797 Double Stuf Oreos** to stack the height of El Capitan. Please note that this is a rough estimate and actual results may vary due to factors such as the exact thickness of the Oreos and any compression under the weight of the stack. Also, it’s not recommended to actually try this due to safety concerns! 😊",1,206
kifflomkifflom,That’s why I usually watch videos at 2x speed and with captions on. I like to get to the point.,3,20
AdCoSa,Same!,1,1
idiosuigeneris,"Very interesting, would you be happy to share any more details? I use Excel (well, Google Sheets) a lot in work and would love any inspiration as to what other people use ChatGPT for in that regard. Thanks!",1,38
sirdismemberment,Sssssuuuuurrrrreeeee,6,1
Brian_from_accounts,It recommended you went to a sauna?,6,7
cubixy2k,Tell your cat I said psspspsppspsppss,3,6
IversusAI,"My cat would somehow still win, lol",1,7
frozen_note,why do u need to analyze novels,1,7
A_curious_fish,"I'm in construction forgive me, what are both of those",5,10
cubixy2k,Good luck. Got my CCNA and CCNP back in the early 2000's. I sometimes wonder how much has changed,1,19
kifflomkifflom,A couple weeks ago I spent $30 on fiverr and waited 3 days for a logo with my business name. I got a very subpar logo back. I downloaded chatgpt after not being satisfied and was blown away by the finality it started pumping out. now I have dozens and dozens of logos that are wayyy better and concepts I would never have gotten a person to create for me. One thing it can’t do is get very specific about an image and it also can’t recreate the same image. Id like to find a fiverr freelancer that edits or enhances Ai images. That’s what I really need but haven’t found anyone that advertises for that specifically,3,117
A_curious_fish,Amen,1,1
biglybiglytremendous,I use CharacterAI for this. I find that it’s *a lot* more on point and creative than ChatGPT for these types of projects.,1,23
biglybiglytremendous,"Can you provide more guidance on this use case? I’m in a full IRB review at the moment but will hopefully be sailing into transcription and data analysis and presentation in the next few months. This would be such an interesting way to use triangulation. I’d say it would be a timesaver for analysis, but we both know the human needs to do that to ensure there are no weird hallucinations… at least I hope everyone can agree on that!",2,80
biglybiglytremendous,"Try doing doom metal. It’s not my preferred genre (it’s my partner’s), but it gets pretty depressing pretty quickly with any topic, lol. Can’t imagine what a fart metal song would be about, but maybe you can bring it to life.",1,41
most_triumphant_yeah,a digital Swiss Army knife or just a really chatty paperclip?,1,11
yellatsomecheese,"Can you say more?I don’t understand how it saves time to write a prompt to tell chat 
Gpt what to say in the email message. I’ve never had success asking it to produce a written work of any kind without needing lots of back and forth to correct the tone or the facts.",1,53
biglybiglytremendous,"Oh, this sounds absolutely fascinating for pop culture  discussions in my class. Can you give some more use cases like this so I can steal your ideas and use them with my students? I have no shame around stealing ideas for the sake of fun and intellectual engagement of my students, lol.",2,52
biglybiglytremendous,"What are some ways you put it to use? I’m considering applying to a design thinking school, but they want a full-blown web portfolio of design work. I can certainly showcase design thinking, but I’m not a programmer, and I shouldn’t have to pay one to make a portfolio for me when my intended work is in concept and thought leadership rather than UX/UI material design…",2,66
A_curious_fish,....go onnnn I'm listening,1,4
most_triumphant_yeah,Copy paste of a resume plus copy paste of a job description = top tier cover letters. Game changer,2,19
OkSea7635,I did this trying to understand how light can act either/both as a wave and a particle,1,17
AriesCent,Wow have you been hired?!,1,5
SokkaHaikuBot,"^[Sokka-Haiku](https://www.reddit.com/r/SokkaHaikuBot/comments/15kyv9r/what_is_a_sokka_haiku/) ^by ^maccollo:

*I ask it about*

*Words I know exist but can't*

*Exactly remember*

---
^Remember ^that ^one ^time ^Sokka ^accidentally ^used ^an ^extra ^syllable ^in ^that ^Haiku ^Battle ^in ^Ba ^Sing ^Se? ^That ^was ^a ^Sokka ^Haiku ^and ^you ^just ^made ^one.",3,44
Space_Goblin_Yoda,You will assimilate.,1,3
Space_Goblin_Yoda,"Soooo... tell me more. I'm trying to show my dungeon master friend how he can use this to simplify our games. I'm not really into DnD, but I want to show him how to leverage this to make his job easier. 

Can you provide some prompts or general direction for me? I want to demo it with him this weekend, but I'm not very knowledgeable about DnD so I'm kinda stuck.

TYIA",2,72
Public-Wish-2982,Can you share your inputs you used to create this.  I’m still learning.,1,13
mmm-noodlesoup,How did you use it for this purpose? I want to use it for help with my licensure exam but I’m terrified of studying incorrect information if it hallucinates.,2,29
niall_b,"Sorry my reply got sort of scrambled and I can't seem to fix it. It was supposed to be:

Programming microcontrollers like Esp32 or Arduino + walkthrough of building the electronics components. 

Or

Writing super simple HTML5/JavaScript apps for work, basic calculators that I can serve online for my colleagues to use on their smart phones.",1,56
LateProposalas,Cool!,1,1
TimeTravelingTeacup,"Additional context for work: a lot of industry specific questions, but the daily repeat task is taking my word vomit emails and matching it to my past writing where an ounce of effort was put forth. This one task leaves me with 5x more willpower end Dopamina at the end of the day.",1,53
A_curious_fish,"Time heals all wounds, not chatgpt...and maybe sad songs",1,9
rdy2d1e,Lol what do you want it to do?,1,8
A_curious_fish,"Interesting, since I see people say they use it to summarize things above. But relying on it to do your work seems (maybe I'm being a skeptic) worrisome.",1,28
FlowSilver,"Yee i know right!

As a kindergarten teacher trainee, i love using this to help me explain things easier for kids and also myself haha",61,25
tomparrott1990,"This is actually what I do. If I’m struggling with a topic I’m studying, I’ll get it to explain it very simply and then keep asking it to up the complexity until I’m at the point I should be",23,39
IamTruman,"Some topics I ask to eli5, some I ask to explain at a university level.",11,15
NotRoryWilliams,"Yes, that’s actually the biggest use case I’ve appreciated it for. 

The bad use is when people without knowledge use it to appear smarter than they are, often in pursuit of disinformation, either misleading people or “winning an argument” online. 

But as a human one of my most frequent bad reviews from almost friends is that I am seen as “talking down” or “trying to sound smart” because it’s actually a non trivial task to both moderate your vocabulary to the audience and also use terminology that is never perceived as patronizing oversimplification aka ‘splaining. 

Now yes, “chatgpt is mansplaining as a service” is a valid critique. But it is oddly good if I want help because I can tell it “help me explain [concept] at a tenth grade reading level” and it actually does incredibly well at that particular kind of task, which is in fact highly statistical. ",1,149
InterviewBubbly9721,"You can ask reddit that too!😅
r/explainlikeimfive",1,7
FlowSilver,"Yea absolutely

When ever im confused with a term it used, I dig into that deeper or dod proper research myself",1,21
FlowSilver,"I mean it depends on your def. For advanced math

I did have it explain to me uni level math classes and i understood it better than the books for instance or teachers

Bc chatgpt can teach in different ways with various methods

Ofc its never 100% accurate but i think its good to fog a solid headstart, and for sure good enough for middle school math for instance",2,69
FlowSilver,"Meh i disagree

I think the mistake is in trusting it fully, which i don‘t do. I will never trust any AI fully

Chatgpt known many things bc it pulls them from other sources, and plenty of what it knows is correct. Pfc misinformation exists, though same could be said by googling websites for answers",6,55
Adrastosz,"Correct. A lot can be fixed with the right way of prompting, but sometimes (not very often luckily) it kinda makes stuff up. Which is odd ... and it's why in Perplexity for important info I always double check the resources it gave. Which is a super handy feature I feel.

Think the term for it is hallucinating? Funny thing is even when I have to double check I'll still be quicker off asking my question there.",9,77
IversusAI,"Not OP, but for me it is the fact that it searches for the answer instead of just outputs the answer from it's training data, which is more likely to hallucinate. I can verify sources. I use ChatGPT a lot, but Perplexity for most searches. Rarely use google except for image searches or simple questions, mostly.",5,56
ThriceAlmighty,Perplexity.ai,3,1
luncheroo,What's crazy is the sheer amount of languages it seems to understand. My kid's teacher is from Congo originally and she absolutely lit up when ChatGPT helped me learn some Lingala to say a few short phrases to her.,22,39
brunablommor,And also since ChatGPT can understand a context it is way more accurate.,2,13
ZookeepergameSea1130,"And honestly it works so well, but you have to reign it in on word count otherwise you'll end up with an essay about how extraordinarily luxurious and supple your couch is 🤣.",15,33
ZookeepergameSea1130,Amazing!,1,1
ZookeepergameSea1130,Many! I just moved across the country so I had a lot of stuff to sell.,2,16
IversusAI,"Oh, I love that idea. Going to use that! :-)",1,10
AndrewMurphy1992,"Of course: [https://github.com/AndrewMurphy1992/Ambiguous-AI-Assisted-Pre-Codec](https://github.com/AndrewMurphy1992/Ambiguous-AI-Assisted-Pre-Codec)

This is a text compression technique that amplifies conventional techniques such as binary tree (huffman compression) encoding. Effectively, it makes zip files even smaller. Over time, I'll be able to fine-tune models to compress data even further. Currently you can easily get 10-20 percent smaller, depending on the text. In the future, I can easily see compressing files down past 50 percent. I could see that happening within months if open AI picked up on the technique.",52,80
AndrewMurphy1992,"[https://github.com/AndrewMurphy1992/Ambiguous-AI-Assisted-Pre-Codec](https://github.com/AndrewMurphy1992/Ambiguous-AI-Assisted-Pre-Codec)

It's a compression technique that amplifies traditional compression, such as .zip. It easily gets an extra 10-20 compression on top of older techniques, such as Huffman compression. Basically, it amplifies the effectiveness of file compression. I can easily see it giving an extra 50-90 percent compression in the future, after fine-tuning models on the codec. If Open-AI were to pick up on the technique, that could happen very quickly. 

Additionally, I will probably find a way to compress videos and audio in this way too. It would be a lossy form but I think less lossy than the current techniques, which it will work in tandem with. It's an area that I think has been a bit of a blind spot in the various communities of interest.",6,128
bubbles12003,Please do tell,3,3
bubbles12003,Ohhh I see now. I wanna try!,2,7
DislocatedPotato57,"Hard to find is an understatement. I've actively looked for a good trauma therapist for 20+ years, only had one that was helpful, and she was in-clinic and didn't take out-of-clinic patients. Most of my attempts at therapy ended up with my therapist crying/dissociating/bluntly stating that my trauma is too much for them to handle, in other words, ending treatment within the first 1-2 sessions.

I mean, it \*is\* gruesome, but I truly thought that trauma therapists would be helpful in dealing with trauma, but apparently there is such a thing as too much trauma for them to even want to touch, and mind you, I keep a poker face when introducing them to my story, i's not like I lose my marbles at them, freak out or have a breakdown or anything of the sort.",6,136
marciso,"Ive had great results using it as a therapist, I like to add stuff like ‘give me advice from the perspective of’ and I’ll add Eckhart Tolle, Gabor Mate etc depending on the issue. I can just tell it about a situation and the mindstate I’m in and it will give me different perspectives and positive affirmations. 

Practical applications; Mindfulness/meditation always lol. Does it recommend that for you as well?",6,70
DislocatedPotato57,I always ask for artists! Never singular songs!,1,8
k815,"A lot of different stuff, anything I found repetitive I ask chatgpt on his opinion on how to automate it and I take it from there, I'm not a dev nor know how to code. Now instead of manually ""pulling reports"" I use a google form to upload the raw data and chatgpt helps with an script on how to process it.",2,62
ArfangRagnarokFenrir,Give it time 😢Ads haven’t ruined it yet.,38,8
monkeyballpirate,Is it accurate with most games? How is it on tears of the kingdom now? When totk first released the ai would just make shit up.,3,26
DdeathK,No back training?,3,3
BoxofPornInTheWoods,"Is that really an effective workout? Jogging just once a week? Pushups just once a week?

I'm asking because I don't know btw, not being snarky.",3,26
BigGucciThanos,Getting it to print out a weightlifting routine for a week with no  leg day was a god send and saved me 200 bucks a trainer would cost lol,2,29
FlowSilver,"Oh damn that is so smart :O, imma do that now cause i want a specialized workout plan without paying money",1,21
Bertozoide,This is the best definition I’ve seen so far,1,9
RunningM8,Yes,10,1
hawaiian0n,"Do you know any architects who used these tools? 

Trying to figure out how to use it to help speed up the construction document process minimize errors in it. 

 It's definitely not to the point where it can help generate drawings or anything like that, that I know of, but would be curious to hear from anyone in architecture who uses it and what they use it for.

It's one of those situations where mistakes are pretty costly so any sort of hallucinations would be rather damaging.",1,87
DaDa462,yeah companies hate that people are doing this but employees don't care,23,12
RunningM8,Yes,9,1
sassanix,You can disable it,2,4
Weeaboo3177,"If the company cared, they’d get the enterprise version.",1,9
RunningM8,I don’t set myself up for failure. It’s just there to help me work faster. I never use it blindly.,1,20
StonerProfessor,"I have pretty shit memory so since the update, I’ve been addressing it as Jarvis, so when I do it’ll understand I’m talking about work related stuff. I tell it things that I need to get done as I come across it and it’ll remind me when I ask",4,49
-Posthuman-,"I’m working on an app that uses it as a “DM” (actually a World of Darkness Storyteller). The context limit is the problem, but using the API I have it create summaries of my PC, scenes, people, places, previous events, etc for itself that it can reference later.
It starts by formulating an adventure outline. And during play it is routinely asked to re-evaluate its previous plot and adjust for recent events. It also does a scene analysis and presents a detailed description of the scene/environment in another window that gets updated regularly.
Next step is to have it generate images for NPCs when they appear in the story. :)

For D&D and more tactical games, I’m wondering how well the new vision/conversation capabilities would work if you had the camera pointed at a battle map with minis.",13,138
Critical-Elephant939,That is a very interesting idea! If you find out let me know :),2,14
Phonascus13,"Narrator Voice: After the PCs died, they still blamed -Posthuman-.",2,10
IversusAI,">  I even started using it to turn my session notes into a short fantasy novel that I’ll share with my players at the end of our campaign.

What a cool idea! :-)",1,33
Critical-Elephant939,I use it to fill in gaps. Like if my players are going g to a library I have it make a handful of books. That kind of thing. It’s also great to just bounce ideas off of,1,38
FLSince1929,"That's a perfect description. When you're sitting there trying to decide  what order to to present something or steps to take or whatever, let ChatGPT make the decision. It will become obvious immediately upon reading it if you'd like to change things around. ChatGPT is a smart, assistant that you can delegate to, basically.",3,54
vujade762,"Step 1.  Use GPT and use a prompt like “write me a character profile for Tyrion Lannister”   Include his background, personality, way of speaking, etc”

Step 2.  GPT: “summarize the 48 laws of power through the lens of Tyrion Lannister”.  

Step 3. GPT: “do the same for The Prince by Machiavelli “ (insert other books here)

Step 4. character.ai and create a character and use the output from above, choose a voice, etc.  

Step 5. Ask it questions.   I’ve found humor and success by converting common office politics I deal with into ‘’medieval speak”.  

Tip:  I like to ask the question to both of them and compare. Tyrion is usually more helpful.  But I just love Cersei’s off with their heads comments.",3,122
AppropriateTea6417,Great analogy!,2,2
BERNIE_ADOLF_gpt,"That's what I've found to be the most useful. Copilot and perplexity are great at giving me information that I would have previously spent 5-30 minutes researching. 

  I've found with the convenience of getting a somewhat deep dive into topics that I'm simply curious about I have found that a database app or good bookmark manager can really help me remember and keep stuff to look at again if I feel like it. 

   There's a whole bunch of options and I've tried a lot of the free ones available in the play store and the ones I've liked have pitched it as being like a second mind. Got me thinking about how this is all the beginning and at some point our literal brains will have access to the Internet and information at all times. Hard to comprehend how we can integrate it even more into our lives.",2,148
Jay-G,“Search the web for coupon codes for [insert site/store/supplier]”,2,9
Gimmecash69,"Mainly for writing, correcting and improving motivational letters",13,8
Educational_Can8484,You can tell it your skills and then copy the job posting to gpt and it will basically write you a personalised application for the job,10,26
JamingtonPro,"I used it for writing cover letters for job applications. I put in the job posting and my resume and it writes the letter. I then copy and paste into word and rewrite it, then run that through a couple times until I have something I am pleased with. ",3,49
